{
  "schema_version": "1.0.0",
  "source_of_truth": "identity.json",
  "brand_name_fa": "آهنگ‌بان",
  "brand_name_latin": "Ahangban",
  "approved_spellings": {
    "fa": ["آهنگ‌بان"],
    "latin": ["Ahangban"]
  },
  "avoid_spellings": ["آهنگ بان", "آهنگبان", "Ahang Ban"],
  "short_description": "آهنگ‌بان هویتی فارسی‌محور برای پیدا کردن و شناختن موسیقی و محتوای مرتبط است.",
  "full_description": "آهنگ‌بان برای ساده‌تر کردن مسیر میان شنونده، اثر و سازنده تعریف شده است. جهت‌گیری برند بر اطلاعات روشن، توجه به تنوع موسیقی و احترام به حقوق پدیدآورندگان استوار است. این معرفی، توصیف جهت برند است و فعال‌بودن هیچ قابلیت محصول را تأیید نمی‌کند.",
  "about": "آهنگ‌بان نام و هویت یک پروژهٔ فارسی‌محور در حوزهٔ کشف و اطلاعات موسیقی است. این مخزن شامل بستهٔ هویت و برنامه‌ریزی است؛ محصول آنلاین، آرشیو عمومی یا قابلیت پخش/دانلود از آن احراز نمی‌شود.",
  "mission": ["کوتاه‌کردن مسیر میان شنونده، اثر و سازنده.", "ارائهٔ اطلاعات روشن دربارهٔ اثر و روش دسترسی، در صورت پیاده‌سازی محصول.", "بازنمایی محترمانهٔ تنوع ژانر، نسل و زبان.", "توجه به حق هنرمند، صاحب محتوا و انتخاب کاربر.", "پرهیز از ادعایی که محصول یا مدرک آن را ثابت نکرده است."],
  "vision": "چشم‌انداز رسمیِ مصوب در مخزن یافت نشد؛ عبارت پیشنهادی برای تصمیم‌گیری: ساخت تجربه‌ای قابل‌اعتماد برای کشف و شناخت موسیقی فارسی‌زبان.",
  "values": ["دقت و قابلیت راستی‌آزمایی", "شفافیت دربارهٔ منبع و وضعیت", "احترام به حقوق و انتساب درست", "تنوع و پرهیز از کلیشه", "سادگی و دسترس‌پذیری"],
  "positioning": "هویت فارسی‌محور برای کشف و شناخت موسیقی و محتوای شنیداری؛ جایگاه محصول و مزیت رقابتی هنوز با دادهٔ بازار تأیید نشده است.",
  "audiences": [{"group":"شنوندگان فارسی‌زبان","needs":["پیدا کردن نام اثر یا هنرمند", "شناخت نسخه و اطلاعات پایه", "فهم روشن از روش دسترسی"],"evidence_status":"تعریف راهبردی؛ پژوهش مخاطب مستند در مخزن نیست"},{"group":"هنرمندان، ناشران و صاحبان حقوق","needs":["انتساب درست", "ثبت اطلاعات و حدود اجازه", "مسیر قابل پیگیری برای همکاری یا اصلاح"],"evidence_status":"تعریف راهبردی؛ کانال عملیاتی تأیید نشده"}],
  "value_proposition": "جهت ارزش پیشنهادی: کمک به کشف و شناخت موسیقی با اطلاعات شفاف و رویکرد مسئولانه به حقوق؛ هنوز با محصول زنده یا پژوهش کاربر اعتبارسنجی نشده است.",
  "voice": {"personality":["جدی اما نزدیک","روشن","دقیق","مسئول"],"consumer_address":"تو؛ در متن‌های کوتاه شنونده و رابط","formal_address":"شما؛ در حقوق، همکاری و مکاتبهٔ رسمی","preferred_terms":["آهنگ‌بان","هنرمند","اثر","نسخه","منبع","وضعیت دسترسی","در انتظار بررسی"],"avoid_terms":["بزرگ‌ترین آرشیو","همهٔ آهنگ‌ها","دانلود رایگان و نامحدود","رسمی","انحصاری","قانونی"],"avoid_terms_note":"از واژه‌های ادعایی فقط با مدرک مشخص، تأیید مسئول و محدودهٔ روشن استفاده شود."},
  "tagline": {"text":"از پیدا کردن تا شنیدن.","status":"WORKING_DRAFT","note":"شعار کاری در اسناد موجود است؛ تصویب نهایی آن ثبت نشده است."},
  "key_messages": ["از پیدا کردن تا شنیدن. (پیش‌نویس شعار)","اطلاعات روشن، انتساب درست و احترام به حقوق.","قابلیت‌ها را فقط پس از فعال‌شدن و تأیید اعلام کنید."],
  "web": {"primary_domain":"ahangban.ir","domain_evidence":"در اسناد مخزن، خرید دامنه طبق اعلام مالک گزارش شده است؛ این مخزن مالکیت فعلی، DNS، SSL یا فعال‌بودن وب‌سایت را مستقلاً تأیید نمی‌کند.","verified_live_urls":[]},
  "public_contact": null,
  "organization_history": {"founded_on":null,"legal_entity":null,"ownership":null,"note":"تاریخچه، مالک حقوقی، شخصیت سازمانی و اطلاعات تماس عمومیِ تأییدشده در مخزن موجود نیست."},
  "capabilities": {"implemented_and_verified":[],"documented_as_goals_or_examples":["کشف/جست‌وجوی موسیقی", "پخش صوتی", "دانلود", "موزیک‌ویدئو", "پادکست", "ریمیکس", "پلی‌لیست"],"note":"موارد دوم در راهنماها به‌عنوان هدف، الگو یا نمونه مطرح‌اند؛ هیچ‌کدام به‌عنوان قابلیت فعال سایت تأیید نشده‌اند."},
  "rights_and_ownership": {"brand_trademark":"UNKNOWN","logo_and_original_artwork":"مالکیت و مجوز مستقل به‌طور مستند ثبت نشده؛ فایل‌های موجود working draft محسوب می‌شوند.","font":"Vazirmatn؛ مجوز SIL Open Font License 1.1 در assets/fonts/OFL.txt موجود است.","music_and_third_party_media":"مجوز انتشار از وجود نام/تصویر/فایل نتیجه نمی‌شود؛ برای هر اثر و نوع استفاده مدرک جدا لازم است.","authoring":"پدیدآورندهٔ تک‌تک دارایی‌ها/مستندات در metadata ثبت نشده است."},
  "last_reviewed_on": null
}
